{
  "brand_id": "signal-roasters",
  "created_at": "2026-09-02T00:00:00Z",
  "one_line_input": "A subscription coffee roastery for people who work from home, called Signal Roasters. We ship small-batch beans roasted within 48 hours of your delivery window, timed to when you actually run out, not a fixed calendar day. For remote workers who treat their 9am cup as the start of the workday, not a treat. Different from big subscription roasters because we don't upsell merch or gimmicky flavors - just consistently good coffee on a schedule that matches your actual consumption. We refuse to look like a lifestyle brand with beach photos and hygge blankets - this is a tool for getting your workday started, photographed like equipment, not a mood board.",
  "positioning": "Signal Roasters ships small-batch beans roasted within 48 hours of a delivery window timed to when you actually run out, not a fixed calendar date — for remote workers whose 9am cup is a start-of-shift trigger, not a treat. Every researched competitor (Trade, Atlas, Bean Box) competes on variety, curation, and unboxing presentation and ships on a fixed interval, leaving the customer to manually skip or delay when the timing is wrong; Signal treats consumption-matched timing as the core mechanic, not a support workaround.",
  "audience": "A remote worker who has run out of coffee mid-morning on a workday and found that more disruptive than a missed package — they don't want to curate flavors or discover new origins, they want the cup to reliably be there when the workday starts, on a schedule that adjusts to how fast they actually go through a bag.",
  "tone": "Plain, operational, a little dry — reads like equipment documentation or a status readout, not a love letter to coffee. States facts (roast date, delivery window, days remaining) instead of adjectives. Never sounds like: cozy, artisanal-with-a-story, apologetic about being a subscription, or excited about surprise and discovery.",
  "visual_pillars": [
    "Product photographed like equipment on a plain surface — flat even lighting, no lifestyle staging, no hands-wrapped-around-mug shots, no steam-and-window-light",
    "Palette stays desaturated and utilitarian (charcoal, bone, one signal accent color) — no warm golden-hour coffee-shop tones and no travel/postcard color palettes",
    "Typography is a monospace or grotesk workhorse face, never a script or serif associated with 'craft' branding",
    "Every image includes a legible timing/schedule element (roast date, days-remaining countdown, delivery window) somewhere in frame — the mechanism is always visible, not implied",
    "Composition is grid-based and symmetrical, like a spec sheet or dashboard, never an artfully-scattered flat-lay with props"
  ],
  "avoid": [
    "Lifestyle photography (blankets, sweaters, window light, someone gazing out a window with a mug, beach or hygge scenes)",
    "Unboxing-as-value theater — postcards, extravagant bag design, or any packaging flourish that competes with the product itself for attention",
    "Seasonal gimmick flavors or copy referencing them (pumpkin spice, holiday blends)",
    "Merch upsells at checkout (mugs, tote bags, apparel) as a growth lever",
    "Discovery/variety framing ('surprise you every month', 'explore new origins') — the pitch is reliability, not exploration",
    "Any claim of 'ethically sourced' or 'small-batch craft' without a specific, checkable fact behind it"
  ]
}
